{
  "schema_version": "0.2",
  "id": "node/canonical-smoke",
  "version": 2,
  "kind": "testing",
  "objective": "Produce a harmless tracked-file candidate patch inside the bounded local node sandbox.",
  "context": {
    "summary": "Integration fixture for canonical Work Unit v0.2 -> node binding -> worker ResultManifest v0.1.",
    "references": [
      "schemas/work-unit-v0.2.schema.json",
      "schemas/node-execution-binding-v0.1.schema.json",
      "schemas/result-manifest-v0.1.schema.json",
      "config/compute-policy.json"
    ]
  },
  "inputs": [
    {
      "id": "source-repository",
      "type": "git_ref",
      "locator": "https://github.com/MSKazemi/idkmesh"
    }
  ],
  "outputs": [
    {
      "id": "candidate-patch",
      "type": "patch",
      "description": "Unverified candidate patch generated by the local node.",
      "media_type": "text/x-diff"
    }
  ],
  "dependencies": [],
  "requirements": {
    "capabilities": ["git", "container-execution", "python"],
    "resources": {
      "cpu_cores_min": 0.5,
      "memory_mb_min": 128,
      "disk_mb_min": 1,
      "gpu": "none",
      "accelerator_capabilities": []
    }
  },
  "constraints": {
    "allowed_paths": ["README.md"],
    "forbidden_paths": [".github/**", "SECURITY.md"],
    "policies": ["candidate-only", "independent-verification-required", "zero-project-spend"]
  },
  "uncertainty": [],
  "security": {
    "risk_class": "low",
    "data_classification": "public",
    "minimum_worker_trust": "untrusted",
    "sandbox_required": true,
    "notes": "Controlled Docker smoke task only; not an arbitrary hostile Internet workload."
  },
  "permissions": {
    "network": "none",
    "network_allowlist": [],
    "filesystem_write": ["README.md"],
    "secrets": [],
    "process_execution": true
  },
  "verification_policy": {
    "strategy": "all_required",
    "independent_from_worker": true,
    "minimum_independent_verifiers": 1,
    "acceptance_rule": "All required validators must pass; successful worker execution remains an unverified candidate."
  },
  "validators": [
    {
      "id": "result-manifest-schema",
      "type": "schema",
      "required": true,
      "description": "Worker output must validate as ResultManifest v0.1."
    },
    {
      "id": "independent-review",
      "type": "review",
      "required": true,
      "description": "A party independent of the worker must evaluate the candidate."
    }
  ],
  "evidence_requirements": [
    {"type": "artifact_hash", "required": true},
    {"type": "review", "required": true}
  ],
  "budget": {
    "wall_seconds": 60,
    "compute_units": 1,
    "human_minutes": 2,
    "tokens": 0,
    "project_spend_usd_max": 0,
    "paid_fallback_allowed": false
  },
  "provenance": {
    "created_by": "idkmesh-project",
    "creator_type": "system",
    "source": "canonical node integration work",
    "source_revision": "b1397a9be91da6570e8ae370de4fa9f4bc44df5c"
  },
  "failure_semantics": {
    "retryable": false,
    "max_attempts": 1,
    "on_failure": "stop"
  },
  "extensions": {
    "org.idkmesh.node.execution": {
      "schema_version": "0.1",
      "source_input_id": "source-repository",
      "source_revision": "b1397a9be91da6570e8ae370de4fa9f4bc44df5c",
      "capabilities": ["git", "container-execution", "python"],
      "container": {
        "image": "python:3.12-alpine",
        "command": [
          "python",
          "-c",
          "from pathlib import Path; p=Path('README.md'); p.write_text(p.read_text() + chr(10) + '<!-- idkmesh-node candidate smoke -->' + chr(10))"
        ]
      },
      "limits": {
        "timeout_seconds": 30,
        "cpus": 1.0,
        "memory_mb": 256,
        "pids_limit": 64
      },
      "output_limits": {
        "max_patch_bytes": 1000000,
        "max_log_bytes": 262144
      }
    }
  }
}
