{"budget":{"compute_units":1,"human_minutes":20,"paid_fallback_allowed":false,"project_spend_usd_max":0,"tokens":20000,"wall_seconds":900},"constraints":{"allowed_paths":["docs/specifications/BENCHMARK_COHORT_V0_1.md"],"forbidden_paths":[".github/**","schemas/**","benchmarks/**","verification/**"],"policies":["candidate-only","independent-verification-required","zero-project-spend","benchmark-definition-immutable"]},"context":{"references":["schemas/work-unit-v0.2.schema.json","schemas/result-manifest-v0.1.schema.json","schemas/evaluator-plan-v0.2.schema.json","docs/specifications/BENCHMARK_COHORT_V0_1.md"],"summary":"The contract explains lifecycle semantics but lacks a compact contributor checklist for freezing the first five-task cohort.","max_context_bytes":200000},"dependencies":[],"evidence_requirements":[{"required":true,"type":"artifact_hash"},{"required":true,"type":"review"}],"extensions":{"org.idkmesh.benchmark":{"cohort":"phase-b2-first-five","task_family":"documentation_contract"}},"failure_semantics":{"max_attempts":1,"on_failure":"stop","retryable":false},"id":"benchmark/phase-b2/005-first-five-freeze-checklist","inputs":[{"id":"source-repository","locator":"https://github.com/MSKazemi/idkmesh","type":"git_ref"}],"kind":"documentation","objective":"Add a First-five freeze checklist documenting the exact pre-outcome gates for the first Phase B2 cohort: immutable source SHA, five-family coverage, WorkUnit/EvaluatorPlan commitments, definition_digest, pending evidence, and zero integration authority.","outputs":[{"description":"Unverified candidate patch against the frozen source revision.","id":"candidate-patch","media_type":"text/x-diff","type":"patch"}],"permissions":{"filesystem_write":["docs/specifications/BENCHMARK_COHORT_V0_1.md"],"network":"none","network_allowlist":[],"process_execution":true,"secrets":[]},"provenance":{"created_by":"idkmesh-project","creator_type":"system","source":"Phase B2 first-five benchmark definition","source_revision":"9c53bb4069a5db1c0688dbbe7a8f028540cbf7c2"},"requirements":{"capabilities":["git","python"],"resources":{"accelerator_capabilities":[],"cpu_cores_min":0.5,"disk_mb_min":32,"gpu":"none","memory_mb_min":128}},"schema_version":"0.2","security":{"data_classification":"public","minimum_worker_trust":"untrusted","notes":"Public repository task. Worker must not modify evaluator/control artifacts.","risk_class":"low","sandbox_required":true},"uncertainty":[],"validators":[{"description":"Worker output must validate as ResultManifest v0.1.","id":"result-manifest-schema","required":true,"type":"schema"},{"description":"Independent evaluator must verify artifact/log integrity, patch scope, and verifier-owned semantic expectation.","id":"independent-review","required":true,"type":"review"}],"verification_policy":{"acceptance_rule":"Both required validators must pass; worker self-report is not acceptance and verifier support is not merge authority.","independent_from_worker":true,"minimum_independent_verifiers":1,"strategy":"all_required"},"version":1}
