{"budget":{"compute_units":1,"human_minutes":20,"paid_fallback_allowed":false,"project_spend_usd_max":0,"tokens":20000,"wall_seconds":900},"constraints":{"allowed_paths":["tests/test_e015_phase_diagram.py"],"forbidden_paths":[".github/**","schemas/**","benchmarks/**","verification/**"],"policies":["candidate-only","independent-verification-required","zero-project-spend","benchmark-definition-immutable"]},"context":{"max_context_bytes":200000,"references":["schemas/work-unit-v0.2.schema.json","schemas/result-manifest-v0.1.schema.json","schemas/evaluator-plan-v0.4.schema.json","docs/specifications/BENCHMARK_COHORT_V0_1.md"],"summary":"The strict-quorum regression currently hard-codes the 8-of-11 threshold even though the tested analyzer defines the threshold mathematically."},"dependencies":[],"evidence_requirements":[{"required":true,"type":"artifact_hash"},{"required":true,"type":"review"}],"extensions":{"org.idkmesh.benchmark":{"cohort":"phase-b2-first-five-v3","task_family":"test_failure"}},"failure_semantics":{"max_attempts":1,"on_failure":"stop","retryable":false},"id":"benchmark/phase-b2-v3/102-derived-quorum-threshold-test","inputs":[{"id":"source-repository","locator":"https://github.com/MSKazemi/idkmesh","type":"git_ref"}],"kind":"testing","objective":"Remove the hard-coded `need = 8` threshold from the strict-quorum E015 regression and derive the required vote count from the same floor(q*n)+1 rule used by the analyzer, without weakening the existing defect/fix assertions.","outputs":[{"description":"Unverified candidate patch against the frozen source revision.","id":"candidate-patch","media_type":"text/x-diff","type":"patch"}],"permissions":{"filesystem_write":["tests/test_e015_phase_diagram.py"],"network":"none","network_allowlist":[],"process_execution":true,"secrets":[]},"provenance":{"created_by":"idkmesh-project","creator_type":"system","source":"Phase B2 successor v3 pre-outcome benchmark definition","source_revision":"a69aa0ae1ae4862e507511cbd9ad854237d0ad32"},"requirements":{"capabilities":["git","python"],"resources":{"accelerator_capabilities":[],"cpu_cores_min":0.5,"disk_mb_min":32,"gpu":"none","memory_mb_min":128}},"schema_version":"0.2","security":{"data_classification":"public","minimum_worker_trust":"untrusted","notes":"Public repository task. Worker must not modify evaluator/control artifacts.","risk_class":"low","sandbox_required":true},"uncertainty":[],"validators":[{"description":"Worker output must validate as ResultManifest v0.1.","id":"result-manifest-schema","required":true,"type":"schema"},{"description":"Independent evaluator must verify artifact/log integrity, patch scope, and verifier-owned transition expectation.","id":"independent-review","required":true,"type":"review"}],"verification_policy":{"acceptance_rule":"Both required validators must pass; worker self-report is not acceptance and verifier support is not merge authority.","independent_from_worker":true,"minimum_independent_verifiers":1,"strategy":"all_required"},"version":1}
